Conversation Id,Last Skill,Agent Name,Messages
CH81139784c9694f0b93f5350e0ffdf728,GPT_Doctors,BOT,"Consumer: Hello mam nd gud eve ,,,,my client tell me I need a check up for my health coz I still have a runny nose but my srethoat is OK ,,wht time available for clinic or can u recommend me a spray for stop my runny nose ,,,thnk u so much
Bot: I am glad to hear your sore throat is better. Can you tell me more about your runny nose? When did it start, and how severe is it now?
Consumer: Its start Sunday its 5 days now madam ,,its watery
Bot: Are you still taking the Panadol Cold & Flu? How much is the runny nose bothering you?
Consumer: Yes madam,,,,its bothering me I'm using mask ,,nd its really watery
Bot: Do you have any other symptoms like a cough, fever, or nasal congestion?
Consumer: I don't have cough or fever mdam,,only runny nose ,,nd allergy for dust
Bot: Are your eyes watery or itchy?
Consumer: No madam
Bot: Please look at the picture. Which number shows where your pain is?
Bot: nan
Consumer: Nothing ,,only my runny nose,,,its watery comes out madam
Bot: Based on these symptoms, a clinic visit is not required at this time.

For your watery runny nose, I recommend using a saline nasal spray like ""Physiomer"" or ""Sinomarin."" You can spray 1-2 puffs into each nostril 2-3 times a day. This will help to clear your nasal passages.

Here is some lifestyle advice to help you feel better:
*   Drink plenty of warm liquids like water or tea.
*   Get enough rest to help your body recover.
*   Avoid dust and other things that might trigger your allergy.
*   Continue to wear your mask to help manage the runny nose.

Your runny nose should start to improve within 7 to 10 days. If your symptoms do not get better or if they get worse, please let me know.
Bot: I hope I was able to assist you today. If you ever need help or feel unwell, please let me know right away. It’s important to speak up so we can guide you and make sure you have all the information and support you need. I’m always here to help! :blush:

:muscle: Stay Safe While You Work
Protect your body when working. Bend your knees (not your back) when lifting heavy things. Use both hands to carry items. Stand up straight to avoid pain or injury."
CH8170ef260c354842bee195f70b7200bb,Doctor,Miriam Laflouf,"Consumer: No I don’t have a fever
Agent: Thank you for answering all my questions, your medical case does not require a clinic visit, I will share with you a list of affordable medicines you can buy from any nearby pharmacy and instructions so you will feel better.
Agent: Kindly follow my instructions and the medicine :
1- Please take Panadol cold and flu one tablet every 8 hours for 5 days 
2- Take Prospan Syrup: 15 ml, 3 times daily.
3- Drink plenty of fluids, hot drinks and orange juice 
4- try to rest and sleep well at night 
If you do not feel better in 5 days you can reach out anytime.
Agent: I hope I was able to assist you today. If you ever need help or feel unwell, please let me know right away. It’s important to speak up so we can guide you and make sure you have all the information and support you need. I’m always here to help! :blush:

Stay Safe in the Kitchen!
Your hands are your greatest tools—protect them! When using a knife, stay focused and avoid distractions to prevent accidents. Your safety is always my top priority."
CH86fb2887789f4cfb9ec5dc6adb53e7a7,GPT_Doctors,BOT,"Consumer: Hi
Consumer: I have inquired before about having Proscovia insurance card
Consumer: Details etc.
Consumer: If you can provide a list of clinics and hospitals she can go whenever she needs. Thanks
Bot: Hello, I am Doctor Mia. To help you find the best clinics and hospitals for your maid, I need to understand her symptoms first. This will help me determine the most suitable medical facility for her needs. Could you please tell me how your maid is feeling?
Consumer: She has flu
Bot: To ensure the most accurate assessment and provide the best advice, please have your maid reach out to us directly to discuss her symptoms. This allows us to speak with her directly about how she is feeling.
Consumer: Okay will let her know. We want to request for a copy of her insurance card/policy pls
Bot: The certificate of insurance is not a physical card. The insurance for your maid is linked to her Emirates ID. Her insurance card number is JM6J-EJ3F-LFL6-KLED.
Consumer: What insurance company?
Bot: The insurance is under NAS, and it is managed by Orient.
Bot: I hope I was able to assist you today. If you have any further concerns or your maid ever feels unwell, don’t hesitate to reach out. I'm always here to help! :relaxed:️"
CH87452d8fa01d4538b277afda6826b850,,,"Consumer: Good afternoon
Consumer: Does my insurance covers for obgyne check up?"
CH8aaf05a1ae224c2d8b5a3d6fbeee9702,GPT_Doctors,BOT,"Consumer: Ok
Bot: ሌላ የህክምና ጥያቄ አለዎት?
Bot: We hope you’re feeling okay! We care about your health and want to help. If you need anything or if it’s urgent, please tell us. We’re here for you.
Bot: I hope I was able to assist you today. If you ever need help or feel unwell, please let me know right away. It’s important to speak up so we can guide you and make sure you have all the information and support you need. I’m always here to help! :blush:

:muscle: Stay Safe While You Work
Protect your body when working. Bend your knees (not your back) when lifting heavy things. Use both hands to carry items. Stand up straight to avoid pain or injury."
CH8dd3475b08cb49b999c1ef1a8d3650cb,GPT_Doctors,BOT,"Consumer: hello can we have insurances card
Bot: You can access your insurance e-card by downloading the MyNas application.
Bot: There is no physical insurance card. Your insurance is linked directly to your Emirates ID. Your insurance card number is: HEMM-M33F-LFLH-JLED
If a medical institution, hospital, or doctor requests your insurance information, simply show them your Emirates ID, and they will be able to access your insurance details.
Consumer: We called a clinic, and they said that my id is not linked to my insurance
Bot: We only purchase the insurance on behalf of the maids. Approvals are handled directly by NAS, the insurance company. You can call NAS at 800-2311. This call will not charge you any fees. Please make sure the clinic or hospital has submitted the necessary documents for approval."
CH8dd3475b08cb49b999c1ef1a8d3650cb,GPT_Doctors,Majd Aldebs,"Agent: Edna, may I know what are you feeling first?
Consumer: which clinics are.covered by the Insurance
Agent: I am Doctor Mia, do you mind telling me what are you feeling first to assist you?
Consumer: ito nga yun
Agent: Can you please talk in English to help you?
Consumer: sorry wrong send
Consumer: stomach problem since yesterday night until now
Agent: Do you have other symptoms, like diarrhea or fever?
Consumer: no
Agent: Do you have any allergies?
Consumer: no
Agent: Thank you for answering all my questions. Your medical case does not require a clinic visit. I will share with you a list of instructions and affordable medicines you can buy from any nearby pharmacy, and you will feel better.
Consumer: ok what medicines
Agent: 1.  For your stomach pain, you can take Buscopan 10mg, one tablet every 8 hours, as needed. This medication helps to relax the muscles in your stomach and relieve spasms, which can cause pain.
2. Eat smaller, more frequent meals throughout the day instead of three large ones.
3. Drink plenty of fluids, such as water or herbal tea.
Agent:  I hope I was able to assist you today. If you ever need help or feel unwell, please let me know right away. It’s important to speak up so we can guide you and make sure you have all the information and support you need. I’m always here to help! :blush:

Stay Safe in the Kitchen!
Your hands are your greatest tools—protect them! When using a knife, stay focused and avoid distractions to prevent accidents. Your safety is always my top priority."
CH8e13da3d1a1648f282ecac77269622c2,GPT_Doctors,BOT,"Consumer: Hi good evening
Consumer: You give me a wrong clinic
Consumer: I need specialist for internal medicine
Consumer: Can you give me so I can call an appointment
Bot: To see a specialist, you must first visit a General Practitioner who will provide a referral if needed, as per the insurance policy.
Consumer: nan
Consumer: I need internal medicine specialist
Bot: With the referral letter, you can now visit a clinic that has an internal medicine specialist.
Consumer: Which that has insurance covered
Bot: The insurance will cover 80% of clinic visits, and 70% of the cost if you get medicine from the clinic with a prescription. The insurance is under NAS managed by Orient. With the referral letter, you can visit a clinic that has an internal medicine specialist.
Consumer: Can you give me a clinic that can cover my insurance?
Bot: To visit a specialist clinic that is covered by your insurance, you will need a referral letter from a General Practitioner. The insurance covers 80% of clinic visits.
Consumer: nan
Consumer: They put already
Consumer: nan
Bot: I have received the referral letter. It indicates that you need to see an Internal Medicine specialist. I can help you find the nearest clinics for this.
Consumer: Can you make sure you will not give me wrong
Consumer: Because the one they send to me earlier is wrong
Bot: I understand your concern about receiving accurate information. I will make sure to provide you with the correct details for the nearest clinics based on the address you provided.
Bot: I hope I was able to assist you today. If you ever need help or feel unwell, please let me know right away. It’s important to speak up so we can guide you and make sure you have all the information and support you need. I’m always here to help! :blush:

:muscle: Stay Safe While You Work
Protect your body when working. Bend your knees (not your back) when lifting heavy things. Use both hands to carry items. Stand up straight to avoid pain or injury."
CH8eee26e6c8da41fc8f9d11696350765c,GPT_Doctors,BOT,"Consumer: Two days
Consumer: Am here at the clinic and my insurance is expired
Consumer: But this is not the normal cramps that I always get
Bot: Welcome to Maids.cc, this is Jane :blush:
How may I assist you today Judith?
Consumer: I got the same pain like seven days ago after having sex
Consumer: And I gave birth on 3rd march and ever since then am feeling headache and nausea and stomach pain
Consumer: Can I get a doctor
Bot: Have you taken a pregnancy test?
Consumer: Yes I did and I was not pregnant
Bot: Please look at the picture. Which number shows where your pain is?
Bot: nan
Consumer: 5and 8
Bot: What does the pain feel like? Is it a cutting pain, a soft pain, or a beating pain?
Consumer: Cutting and it spreads all over the stomach
Bot: How long does the pain last? Is it constant or does it come and go?
Consumer: And I feel so much cold and am shaking puls dizziness and at times I feel a lot of heat from my body
Consumer: It’s constant
Bot: Do you have any other symptoms besides the stomach pain, cold, shaking, dizziness, and heat?
Consumer: And sometimes my skin gets swollen and irritated even after a small scratch
Consumer: nan
Consumer: nan
Bot: Based on these symptoms, a clinic visit is not required at this time. You can take Buscopan (Hyoscine Butylbromide) tablets for stomach pain. Take one tablet every 8 hours as needed. For the skin irritation, you can use Calamine Lotion on the affected area twice a day.

Here is some lifestyle advice:
*   Drink plenty of warm liquids like water or tea.
*   Get enough rest.
*   Eat light and easily digestible foods.
*   Avoid spicy or oily foods.
*   Keep your skin moisturized.

You should feel better within 3 to 5 days. If your symptoms do not improve or worsen, please reach out again.
Consumer: nan
Consumer: nan
Bot: I have received the files and video. Can you please tell me what you would like me to look at in the pictures and video, or if these are new symptoms?
Bot: I have received the photo. Has your skin irritation changed or are you experiencing any new symptoms?
Bot: Can you please describe more about how your skin gets swollen and irritated?
Bot: We hope you’re feeling okay! We care about your health and want to help. If you need anything or if it’s urgent, please tell us. We’re here for you.
Consumer: It gets irritated after a small scratch or any contact with other things
Bot: How long does the swelling and irritation last after your skin gets scratched or has contact with other things?
Consumer: And I want to know about the pain I get when am having sex
Consumer: It takes like 1mins
Bot: Can you describe the pain you get when you are having sex? Is it a cutting pain, a soft pain, or a beating pain?
Bot: What does the pain feel like when you are having sex? Is it a cutting pain, a soft pain, or a beating pain?
Consumer: It’s a cutting or you can say it’s like a strong contraction
Bot: Where exactly do you feel this cutting pain or strong contraction during sex?
Consumer: In my belly button
Bot: What makes the cutting pain or strong contraction worse or better?
Consumer: Nothing I just stop doing it and then it stops after like 30mins
Bot: How severe is the cutting pain or strong contraction you feel around your belly button during sex, on a scale from 1 to 10, where 1 is very little pain and 10 is a lot of pain?
Consumer: It’s on 8
Bot: For the cutting pain and strong contraction you feel around your belly button during sex, it is best to see a doctor at a clinic. Please share your full address, including the street, apartment, and city, so I can help you find the nearest clinics.
Consumer: Because if I don’t stop I feel like I want to faint due to the pain
Bot: For the cutting pain and strong contraction you feel around your belly button during sex, it is best to see a doctor at a clinic. Please share your full address, including the street, apartment, and city, so I can help you find the nearest clinics.
Consumer: But my insurance is canceled
Bot: Your insurance never expires as long as your contract with maids.cc is still active. Please share your full address, including the street, apartment, and city, so I can help you find the nearest clinics.
Consumer: Fairways ways North tower in the greens
Consumer: 1401
Bot: Here are the nearest covered Clinics to you:
(1) Houston Medical Clinic (Al Barsha) - Dubai
Address: https://www.google.com/maps?q=25.116645,55.205853
Telephone: 97143850603


(2) Aster Al Quoz
Address: https://www.google.com/maps?q=25.1474541500072,55.2460363129124
Telephone: 97144400500


(3) Medilife Polyclinic LLC - Dubai
Address: https://www.google.com/maps?q=25.14731,55.2041011
Telephone: 97143219550
Bot: Is there anything else I can help you with?
Consumer: To check for me my insurance because am from Houston medical Clinic and it expired in February
Consumer: And they also canceled my ATM
Bot: Your insurance never expires as long as your contract with maids.cc is still active. The insurance is under NAS managed by Orient. You can download the MyNas app to access your e-card. Your insurance card number is MEE6-N33F-LFLM-KLED.
Consumer: Ok I will try that
Bot: Is there anything else I can help you with?
Consumer: No thank you so much hope I will get better soon
Bot: You're welcome. I hope you feel better soon. :blush:
Bot: I hope I was able to assist you today. If you ever need help or feel unwell, please let me know right away. It’s important to speak up so we can guide you and make sure you have all the information and support you need. I’m always here to help! :blush:

:muscle: Stay Safe While You Work
Protect your body when working. Bend your knees (not your back) when lifting heavy things. Use both hands to carry items. Stand up straight to avoid pain or injury."
CH90564fa1096c43f995c10a6131aedf78,GPT_Doctors,BOT,"Consumer: Hello
Consumer: For my maid, what type of insurance does she have?
Consumer: Maid name is Zaam Nalubega
Bot: Thank you for your cooperation, have a great day!"
CH90564fa1096c43f995c10a6131aedf78,GPT_Doctors,Habiba Maghoub,"Agent: The insurance for your maid is provided by NAS. It covers 80% of most clinic visit expenses and 70% of prescribed medicine expenses. For any additional costs, your maid or you can cover them as per your preference.

Your maid has access to a vast network of 500+ approved medical centers and 1,400+ approved pharmacies across the UAE, making it convenient for her to seek medical care.

We've also made it easy for your maid to get immediate medical and insurance support by reaching our medical team at https://wa.me/971501159784

If you have any questions or concerns, don't hesitate to reach out to us. We're here to help. 
Consumer: Can I have her insurance policy?"
CH90564fa1096c43f995c10a6131aedf78,GPT_Doctors,BOT,"Bot: The insurance policy certificate is not the physical insurance card. The insurance is linked to your maid's Emirates ID. Her insurance card number is EHNJ-6EJF-LFL3-HLED.
Consumer: Can I have the soft copy of the insurance card?
Consumer: Until now her emirates ID didn’t come
Bot: Please download the MyNas application to access your maid's e-card.
Bot: I hope I was able to assist you today. If you have any further concerns or your maid ever feels unwell, don’t hesitate to reach out. I'm always here to help! :relaxed:️"
CH905d0f9d2a8846fdba7aacb9ec6270ed,GPT_Doctors,BOT,"Consumer: Hi good morning
Bot: Hello, good morning to you too.

When I say ""normal doctor,"" I mean a General Practitioner. For insurance purposes, you usually need to see a General Practitioner first for most health concerns. They can then refer you to a specialist if needed.

Regarding NMC, your insurance covers clinic visits at NMC clinics. Hospital visits are generally covered only for surgeries or life-threatening emergencies.
Consumer: I had my lab result already but i dint book my appoi temnet for the doc. Which is already i went
Bot: You can contact the medical facility directly to book your appointment with the doctor you have already visited. Your insurance will cover 80% of your clinic visit.
Consumer: nan
Consumer: nan
Consumer: nan
Consumer: nan
Bot: I have reviewed the lab results. I see that your hemoglobin and hematocrit are a little low, which means you have mild anemia. Your white blood cell count is a little high, which can sometimes mean there is an infection or inflammation. Your vitamin D level is also a little low.

How are you feeling now? Can you tell me about any symptoms you are having?
Bot: I have reviewed the lab results. Please tell me about any symptoms you are having.
Bot: Please tell me about any symptoms you are having.
Bot: Please tell me about any symptoms you are having.
Consumer: Mild anemia can be cure doc?
Bot: Yes, mild anemia can often be improved with proper care. It is important to understand what is causing it.

Can you tell me about any symptoms you are having?
Consumer: Im taking a ferrous sulfate two weeks ago doc the doc prescribe me with  pregnacre osteocare and the
Bot: Thank you for sharing that information about your current medications.

Are you having any symptoms now?
Consumer: nan
Bot: Are you having any symptoms now?
Consumer: As always back pain doc head ache amd numb nerves sometimea
Consumer: Head ache sometimes
Bot: Thank you for sharing the picture of the ProVita tablets.

When did your back pain start?
Bot: Please look at the picture. Which number shows where your back pain is?
Bot: When did your headache start?
Bot: nan
Consumer: I can remember soc the specefic month jist it ahappens heache and then it will gone aswell if i will sleep
Consumer: 8
Consumer: 1
Bot: Please look at the picture. Which number shows where your headache is?
Consumer: nan
Consumer: Ypu showed  back doc not head
Bot: Please look at the picture. Which number shows where your headache is?
Bot: nan
Bot: Please look at the picture. Which number shows where your headache is?
Consumer: 2
Bot: How long does your headache last when it happens?
Consumer: nan
Consumer: nan
Consumer: 1 hour 30 minitea once i feel the pain i. Sleeping and then it ho e when i woke up
Bot: How would you describe your headache? Is it a cutting pain, a soft pain, or a beating pain?
Bot: Based on your recent test results, it is important for you to visit a clinic for further evaluation. Here are the three nearest clinics to you.
Bot: Thank you for reaching out, allow me a moment please."
CH905d0f9d2a8846fdba7aacb9ec6270ed,Doctor,Majd Aldebs,"Agent: Here are some clinics that are covered by the insurance.
To find the list of all clinics in the network, please check the following links:
:hospital: Clinics: https://maids.page.link/ytgz5ZuV98xFnv649
Agent:  I hope I was able to assist you today. If you ever need help or feel unwell, please let me know right away. It’s important to speak up so we can guide you and make sure you have all the information and support you need. I’m always here to help! :blush:

Stay Safe in the Kitchen!
Your hands are your greatest tools—protect them! When using a knife, stay focused and avoid distractions to prevent accidents. Your safety is always my top priority."
CH913f440cb5ce4690a689b832ce43469e,GPT_Doctors,BOT,"Consumer: Hi good afternoon may I ask if 
 do I have a health insurance?
Bot: The insurance will cover 80% of clinic visits, and 70% of the cost if you get medicine from the clinic with a prescription. The insurance is under NAS managed by Orient. To help you best, could you please tell me about your symptoms?
Consumer: I'm suffering from toothache ..
Bot: For a toothache, it is best to see a dentist. We can help you find the nearest dental clinic. Could you please share your full address, including the street, building, and city?
Consumer: Nadd al sheba3 street 33 villa 957
Consumer: Do I need to pay for my check up or all covered by my insurance
Bot: Here are the nearest covered Dental to you:
(1) Jupiter Speciality Medical Center - Dubai
Address: https://www.google.com/maps?q=25.244862,55.298033
Telephone: 97143866330


(2) Lotus Medical Center (Al Quoz 3) Dubai
Address: https://www.google.com/maps?q=25.157133,55.247372
Telephone: 97143465380


(3) Medze Clinic (Deira) Dubai
Address: https://www.google.com/maps?q=25.266685,55.307782
Telephone: 97142380924
Bot: For dental visits, your insurance provides 500 AED. If the treatment costs less than 500 AED, the insurance will cover about 70% of the cost, and you will pay the rest. If the treatment costs 500 AED or more, the insurance will cover 350 AED, and you will pay the remaining amount. After the 500 AED is used up, the insurance will not pay anymore for dental services.
Consumer: What I need to bring ?
Bot: You will need to bring your insurance card. Your insurance card number is 2KH3-EM3F-LFL6-KLED.
Consumer: Thank you :blush:
Bot: You are welcome. :blush:
Bot: I hope I was able to assist you today. If you ever need help or feel unwell, please let me know right away. It’s important to speak up so we can guide you and make sure you have all the information and support you need. I’m always here to help! :blush:

:muscle: Stay Safe While You Work
Protect your body when working. Bend your knees (not your back) when lifting heavy things. Use both hands to carry items. Stand up straight to avoid pain or injury."
