Conversation Id,Last Skill,Agent Name,Messages
CHacc4dcd6a2dc43f5a3114c934ec80036,GPT_Doctors,BOT,"Consumer: Hi
Consumer: Good day
Consumer: I have a referral internal medicine which hospital I can go?
Consumer: Hi
Consumer: I'm waiting
Bot: I can help you with that. Do you have the referral letter from your General Practitioner? If so, please share it with me.
Bot: Please share the referral letter with me.
Consumer: nan
Consumer: nan
Consumer: Where I will go?
Bot: Based on the referral, you will need to see an Internal Medicine specialist. According to the insurance policy, you must first see a General Practitioner who will then refer you to a specialist if needed.
Consumer: What I will do first??
Bot: You need to see a General Practitioner first.
Consumer: Where is it??
Consumer: Where is that??
Bot: Here are the three closest clinics for a General Practitioner:

1.  **Emirates Hospital Clinic, Dubai Hills Estate**
    *   **Address:** Dubai Hills Estate, Dubai
    *   **Phone:** +971 4 432 9999
2.  **Mediclinic Parkview Hospital**
    *   **Address:** Umm Suqeim Road, Al Barsha South 2, Dubai
    *   **Phone:** +971 4 800 1999
3.  **King's College Hospital London, Dubai Hills**
    *   **Address:** Dubai Hills Estate, Dubai
    *   **Phone:** +971 4 519 9999
Bot: Here are the addresses for the clinics:

1.  **Emirates Hospital Clinic, Dubai Hills Estate:** Dubai Hills Estate, Dubai
2.  **Mediclinic Parkview Hospital:** Umm Suqeim Road, Al Barsha South 2, Dubai
3.  **King's College Hospital London, Dubai Hills:** Dubai Hills Estate, Dubai"
CHacc4dcd6a2dc43f5a3114c934ec80036,Doctor,Miriam Laflouf,"Agent: Please diregard the previous messages, those clinics are not in the insurance network 
I will send you to nearby clinic that you can visit
Consumer: Can you send it now
Consumer: I'm here in alqouz now
Agent: Sure, Give me a moment please
Consumer: Industrial
Agent: They have internal medicine :
Aster Al Quoz Medical Centre
https://maps.app.goo.gl/BNNPFkan9KReBBgy7
+97144400500
Agent: I hope I was able to assist you today. If you ever need help or feel unwell, please let me know right away. It’s important to speak up so we can guide you and make sure you have all the information and support you need. I’m always here to help! :blush:

Stay Safe in the Kitchen!
Your hands are your greatest tools—protect them! When using a knife, stay focused and avoid distractions to prevent accidents. Your safety is always my top priority."
CHad02ec9174ac489eb7114ee2f15a1d52,GPT_Doctors,BOT,"Consumer: I'm fine mam thanks I just only gone for check up no symptoms in Gods will
Consumer: I'm.planing only to undergo for chek up that's it only my hand my finger is I feel like atritis like my nerve in my finger is pain
Consumer: For vitamins maybe our nerve in our hands if tired I feel something
Bot: Welcome to Maids.cc, this is Jane :blush:
How may I assist you today Maria?

I understand you went for a check-up and you're feeling well. That's great to hear! Just so you know, routine check-ups are typically not covered by your insurance. If you need any specific medical assistance in the future, please let me know and I'll be happy to guide you.
Bot: I hope I was able to assist you today. If you ever need help or feel unwell, please let me know right away. It’s important to speak up so we can guide you and make sure you have all the information and support you need. I’m always here to help! :blush:

:muscle: Stay Safe While You Work
Protect your body when working. Bend your knees (not your back) when lifting heavy things. Use both hands to carry items. Stand up straight to avoid pain or injury."
CHad70a94cb3cb44728ffdd7f622025265,GPT_Doctors,BOT,"Consumer: Good afternoon
Consumer: I need to do a follow up regarding braces. Does my insurance cover?
Bot: Dental services are covered by your insurance. The insurance will cover dental consultation, extraction, fillings, root canal treatment, scaling, X-rays, antibiotics, and prophylaxis. Any other service is not covered.

The patient gets 500 AED from insurance for dentist visits. Here is how it works:
1. If the treatment is less than 500 AED, insurance pays about 70%, and the patient pays the rest. Each time, the money left in the 500 AED goes down.
2. If the treatment is 500 AED or more, insurance gives only 350 AED, and the patient pays the rest. After this, the 500 AED is finished.
After the 500 AED is used up, insurance will not pay anymore.

Your insurance card number is 3KN2-2N3F-LFLJ-6LED.
Bot: I hope I was able to assist you today. If you ever need help or feel unwell, please let me know right away. It’s important to speak up so we can guide you and make sure you have all the information and support you need. I’m always here to help! :blush:

:muscle: Stay Safe While You Work
Protect your body when working. Bend your knees (not your back) when lifting heavy things. Use both hands to carry items. Stand up straight to avoid pain or injury."
CHae8f8944a46c4b3a999e8a2dbcefb53c,Doctor,Amal Abdellah,"Consumer: OK I ho back tomorrow accommodation 8 a.m my client hired taxi
Agent: I hope I was able to assist you today. If you ever need help or feel unwell, please let me know right away. It’s important to speak up so we can guide you and make sure you have all the information and support you need. I’m always here to help! :blush:

Stay Safe in the Kitchen!
Your hands are your greatest tools—protect them! When using a knife, stay focused and avoid distractions to prevent accidents. Your safety is always my top priority."
CHaf339119ae1b43b9a32d681a11885bd6,GPT_Doctors,BOT,"Consumer: Hi
Consumer: Could u send the insurance copy for Ms. Selvi
Bot: The insurance certificate is not the physical insurance card. The insurance is linked to the Emirates ID. The patient’s insurance card number is the following: KHHE-JEJF-LFLM-2LED.
Consumer: From which insurance company
Bot: The insurance is under NAS managed by Orient. The insurance will cover 80% of clinic visits, and 70% of the cost if your maid gets medicine from the clinic with a prescription. To help your maid best, please tell me about her symptoms.
Consumer: No appetite
Bot: When did your maid's no appetite start?
Consumer: Morning only
Bot: How long has your maid had no appetite?
Consumer: Today only
Bot: Does your maid have any other symptoms with no appetite?
Consumer: No as of now no appetite only
Bot: How much does your maid's no appetite bother her?
Consumer: Mrng she had little only, now she didn't have anything
Bot: Does your maid have any known chronic conditions or allergies?
Consumer: No allergeies but Diabetes
Consumer: is present
Bot: Please share your maid's address, including the street, apartment number, and city, so I can help you find the nearest clinic.
Consumer: Apartment number 304, Al  Hamidiya 1, Ajman
Bot: Here are the nearest covered Clinics to you:
(1) Clinica Medical Center (Al Zora) Ajman
Address: https://www.google.com/maps?q=25.424139,55.495718
Telephone: 97165619607


(2) Huda Alalousi Specialized Medical Center LLC - Ajman
Address: https://www.google.com/maps?q=25.4194208,55.4867729
Telephone: 97167487776


(3) Skin and Teeth Medical Center LLC - Ajman
Address: https://www.google.com/maps?q=25.4203822941921,55.4899396142208
Telephone: 97167444560
Bot: Is there anything else I can help your maid with today?
Consumer: Suggest anyother clinics also
Bot: You can find more clinics by visiting this link: https://maids.page.link/ytgz5ZuV98xFnv649.
Bot: I hope I was able to assist you today. If you have any further concerns or your maid ever feels unwell, don’t hesitate to reach out. I'm always here to help! :relaxed:️"
CHafdc844c7c9c4cf7bc0e5d47c426f4e8,GPT_Doctors,BOT,"Consumer: nan
Bot: I understand your frustration with the clinic. It's disappointing when you don't receive proper care and attention. Would you like me to help you find a different clinic that might provide better service? Our medical team can assist you with this.
Consumer: I want to check nas
Consumer: How to sign up
Bot: Welcome to Maids.cc, this is Jane :blush:
How may I assist you today Jonalyn?

To sign up for the unemployment insurance plan, please go to https://www.diniloe.ae/nsure/login/#/ , click on ""Private Sector,"" and enter your Emirates ID and phone number. You'll get a code by text message. The insurance costs AED 63 annually or AED 126 every 2 years. To learn more, click here: https://www.iloe.ae/pdf/policy-terms-condition-english.pdf. Remember, if you fail to sign up or renew your ILOE insurance policy, you will be fined AED 403.
Consumer: Mynas insurance
Bot: The Unemployment Insurance is a form of insurance that provides you with financial support if you lose your job. The UAE Government mandates all eligible workers to subscribe to the Unemployment Insurance. This insurance plan costs AED 126 for a 2-year subscription. Failure to subscribe or make timely payments will result in fines. Workers must ensure their compliance to avoid such penalties.
Consumer: Not that one
Bot: I'm sorry for the confusion. Could you please clarify which insurance you're asking about? This will help me provide you with the correct information.
Consumer: Nas insurance
Consumer: I go in the clinic this morning
Consumer: But they reject thats why i cant do bloodtest drip and injection
Bot: We hope you’re feeling okay! We care about your health and want to help. If you need anything or if it’s urgent, please tell us. We’re here for you.
Bot: I hope I was able to assist you today. If you ever need help or feel unwell, please let me know right away. It’s important to speak up so we can guide you and make sure you have all the information and support you need. I’m always here to help! :blush:

:muscle: Stay Safe While You Work
Protect your body when working. Bend your knees (not your back) when lifting heavy things. Use both hands to carry items. Stand up straight to avoid pain or injury."
CHb17e763af79c47289bfc4c496beb249e,GPT_Doctors,BOT,"Consumer: Yeah but I think they are closed
Bot: You should call the clinics directly to confirm their operating hours.
Consumer: Yeah call them
Consumer: I call them no one is receiving
Bot: I understand it can be frustrating when you cannot reach the clinics. I have opened a complaint to the Medical Consultant team about your situation. They will be able to assist you further.
Consumer: I will appreciate
Bot: You're welcome. :blush:
Bot: I hope I was able to assist you today. If you ever need help or feel unwell, please let me know right away. It’s important to speak up so we can guide you and make sure you have all the information and support you need. I’m always here to help! :blush:

:muscle: Stay Safe While You Work
Protect your body when working. Bend your knees (not your back) when lifting heavy things. Use both hands to carry items. Stand up straight to avoid pain or injury."
CHb35126012a494e8390314287d9f9d578,GPT_Doctors,BOT,"Consumer: Maam i dont have money.Maybe you give me some cash assistance:sob:im living here without any:sob: When i came here i am strong now i go back home i have a disease:sob::sob:You dont give me medication or second option of my medical:sob::sob:..Please give me some cash assistance.:pray:
Bot: The Doctor's Manager will reach out to you soon.
Consumer: My flight is 4pm maam.:sob::sob::sob:
Bot: I understand your flight is at 4 PM. The Doctor's Manager will reach out to you soon regarding your request for assistance.
Consumer: thank you so much maam:sob:
Bot: You're welcome. :blush:
Bot: I hope I was able to assist you today. If you ever need help or feel unwell, please let me know right away. It’s important to speak up so we can guide you and make sure you have all the information and support you need. I’m always here to help! :blush:

:muscle: Stay Safe While You Work
Protect your body when working. Bend your knees (not your back) when lifting heavy things. Use both hands to carry items. Stand up straight to avoid pain or injury."
CHb36138acdc034e93a537fb1dd9c2eb23,Doctor,Leen Rizk,"Agent: Please follow this regimen for 6 weeks.
Consumer: Ok
Consumer: Thank you so much
Agent: I hope I was able to assist you today. If you ever need help or feel unwell, please let me know right away. It’s important to speak up so we can guide you and make sure you have all the information and support you need. I’m always here to help! :blush:

Stay Safe in the Kitchen!
Your hands are your greatest tools—protect them! When using a knife, stay focused and avoid distractions to prevent accidents. Your safety is always my top priority."
CHb37535d989a5491a832b76308734c2c8,GPT_Doctors,BOT,"Consumer: nan
Bot: Can you please tell me where exactly you feel the pain?
Bot: I hope I was able to assist you today. If you ever need help or feel unwell, please let me know right away. It’s important to speak up so we can guide you and make sure you have all the information and support you need. I’m always here to help! :blush:

:muscle: Stay Safe While You Work
Protect your body when working. Bend your knees (not your back) when lifting heavy things. Use both hands to carry items. Stand up straight to avoid pain or injury."
CHb46f231c2df149c6be61fb1a9cc24671,Doctor,BOT,"Consumer: Hi
Bot: Hi Johannie! How can I help you today?
Consumer: Can i ask to talk a doctor po
Bot: Hello, I am Doctor Mia. How can I help you today?
Consumer: Hi Doc Mia. I would like to ask a medicine of an allergy po
Consumer: nan
Consumer: Its been 2weeks i have this
Bot: Please send one photo of the allergy so I can see it.
Bot: Can you describe the rash? Is it itchy or painful?
Consumer: nan
Consumer: Only itchy Doc
Consumer: nan
Bot: Does anything make the itchiness worse or better?
Consumer: I put fucidin Cream but its not ease the itchy
Bot: Please tell me if anything makes the itchiness worse or better.
Consumer: Sometimes only itchy when sweating
Bot: Thank you for reaching out, allow me a moment please.
Bot: Is the itchiness constant, or does it come and go?
Consumer: Thank you
Consumer: Come and go Doc"
CHb46f231c2df149c6be61fb1a9cc24671,Doctor,Leen Rizk,"Agent: Has it changed in size, appearance, or spread since then?
Consumer: No change the size.. its spread
Agent: Have you used any new skin or hair products recently (shampoo, conditioner, lotion, perfume)? Any recent exposure to allergens  (pets, dust, new laundry detergent)? 
Consumer: Im using a skin care.. last month and im using the hair color last week
Agent: Do you have any chronic diseases? like hypertension or diabetes?
Consumer: I have that hypentension Doc
Agent: You will feel better with
1-Hydrocortisone cream (1%) Take a small amount and apply a thin layer directly to the itchy or inflamed spots. Use 1–2 times daily, usually in the morning and evening.
2-Cetaphil Moisturizer :This can also help reduce irritation from scratching or dryness.
3-Avoid irritants ,  Stop using any new products introduced around the time symptoms started.
4-Avoid scratching. It can worsen inflammation or cause infection.

- Don't use them for more than 7 days. if you don't feel better or worsen , feel free to reach out to us again we will help you. 
Agent: And please 
Use a fan, cool shower, or cold compress after sweating.
Keep the area dry. 
Consumer: Ok Doc. Thank you
Agent: You are always welcome!
Agent: I hope I was able to assist you today. If you ever need help or feel unwell, please let me know right away. It’s important to speak up so we can guide you and make sure you have all the information and support you need. I’m always here to help! :blush:

Stay Safe in the Kitchen!
Your hands are your greatest tools—protect them! When using a knife, stay focused and avoid distractions to prevent accidents. Your safety is always my top priority."
CHb6b2cc4fe42240a7bab7768ff08a4a3e,Doctor,Miriam Laflouf,"Consumer: Did you reach out to her
Consumer: She needs the insurance to go to dentist
Agent: Whenever you visit the dental clinic, the insurance will cover 70% of the treatment cost, and you'll need to pay the remaining 30%. The insurance will cover up to 500 AED for your treatment as long as the treatment is included in the list of covered services. If your treatment exceeds this amount, you’ll have to cover the difference. For a list of approved dental clinics, please visit https://maids.page.link/HAPdawJNXAyqEaRU7.
Agent: I hope I was able to assist you today. If you have any further concerns or your maid ever feels unwell, don’t hesitate to reach out. I'm always here to help!:blush:"
CHb847696e20294d4fa9d38a55c80763a8,GPT_Doctors,BOT,"Consumer: Good evening
Consumer: Is Aster Hospital Mankhool covered in Emiliana’s insurance? We might need to send her to emergency because her gallbladder is acting up again
Consumer: She’s in deep pain
Bot: Yes, Aster Hospital (Mankhool-Al Raffa) - Dubai is covered by the insurance. I understand this is a stressful situation. Can you please tell me more about the maid's symptoms?
Bot: Yes, Aster Hospital (Mankhool-Al Raffa) - Dubai is covered by the insurance. I understand this is a stressful situation. Can you please tell me more about the maid's symptoms?
Consumer: Severe abdominal pain
Bot: Can you please tell me where exactly on her stomach she is feeling the pain? Please look at this image and tell me the region number.
Bot: nan
Consumer: Between 1&4
Bot: What kind of pain is she feeling in that area? Is it a soft pain, beating pain, or cutting pain?
Consumer: Cutting pain
Bot: I am sorry to hear she is in so much pain. I will provide you with the nearest clinics.
Bot: I hope I was able to assist you today. If you ever need help or feel unwell, please let me know right away. It’s important to speak up so we can guide you and make sure you have all the information and support you need. I’m always here to help! :blush:

:muscle: Stay Safe While You Work
Protect your body when working. Bend your knees (not your back) when lifting heavy things. Use both hands to carry items. Stand up straight to avoid pain or injury."
CHba1b61fadf4741559fe9839430983450,GPT_MV_RESOLVERS,BOT,"Consumer: She went to medical center for consultation they check her insurance as per EID no active insurance as of the moment
Bot: The insurance company, NAS, handles all approvals directly. You can reach them by calling 800-2311. Please make sure the clinic or hospital has sent all the necessary documents for approval.
Consumer: So whats the process when my nanny wants to do check up?
Bot: Your maid must see a General Practitioner first for a check-up. The General Practitioner will refer her to a specialist if needed, according to the insurance policy. Please continue to follow up with NAS at 800-2311 regarding the activation of her insurance.
Bot: I hope I was able to assist you today. If you have any further concerns or your maid ever feels unwell, don’t hesitate to reach out. I'm always here to help! :relaxed:️
Consumer: nan
Consumer: Is this the last record she has on the system
Bot: Thank you for submitting Rosalie's passport.

It will be directly send for the initial government approval, which typically takes 24 to 48 hours. If any document gets rejected, we'll WhatsApp you immediately with the reason, so you can send us another one.
Bot: Could you please clarify what you mean?"
CHbfb2f9f8e5e94041bb7f7728b610ab5b,,,Consumer: hello can we have insurances card
CHc078f3def91849fbb1d73104bdf96fbd,GPT_Doctors,BOT,"Bot: I hope I was able to assist you today. If you ever need help or feel unwell, please let me know right away. It’s important to speak up so we can guide you and make sure you have all the information and support you need. I’m always here to help! :blush:

:muscle: Stay Safe While You Work
Protect your body when working. Bend your knees (not your back) when lifting heavy things. Use both hands to carry items. Stand up straight to avoid pain or injury.
Consumer: Hello
Consumer: I'm not feeling well
Bot: Hello, I am Doctor Mia. How are you feeling unwell?
Bot: We hope you’re feeling okay! We care about your health and want to help. If you need anything or if it’s urgent, please tell us. We’re here for you.
Consumer: Feeling abudomal pain and back pain
Bot: Please look at the picture. Which number shows where your pain is?
Bot: nan
Consumer: 8
Consumer: 7,9
Bot: Please look at the picture. Which number shows where your pain is?
Bot: nan
Consumer: 7,8,9
Bot: When did your abdominal pain and back pain start?
Consumer: It's a week now
Bot: Can you describe the abdominal pain? Is it a cutting pain, a soft pain, or a beating pain?
Consumer: Beating pain
Bot: Can you describe the back pain? Is it a cutting pain, a soft pain, or a beating pain?
Consumer: Beating pain
Bot: Is the abdominal pain constant or does it come and go?
Consumer: Constant more especially when bending over
Bot: What makes your back pain better or worse?
Consumer: Now worse
Bot: Have you tried any treatments or medications for your abdominal pain or back pain?
Consumer: Now
Consumer: No
Bot: Do you have any other symptoms like fever, nausea, vomiting, or changes in your bowel movements?
Consumer: No
Bot: Do you have any known chronic conditions or allergies?
Consumer: No
Bot: Based on these symptoms, a clinic visit is not required at this time. You can take Ibuprofen 400mg tablets every 6 to 8 hours for 3 to 5 days.

Here is some advice that may help you feel better:
* Rest and avoid activities that make your pain worse.
* You can apply a warm compress to your lower back and abdomen.
* Drink plenty of water.

Your symptoms should improve within a few days."
CHc2a53d9c0c65452ebbe61f7cb4fd7dad,GPT_Doctors,BOT,"Consumer: hi good morning
Consumer: im Jerrilyn colminar
Consumer: i jusk asking maam sir if may.insurance is active pls reply thanks
Consumer: hello
Consumer: pls
Bot: Allow me a moment, please. :blush:
Bot: Hello, your insurance is active as long as your contract with maids.cc is active. Your insurance is under NAS managed by Orient, and your insurance card number is K32J-HM3F-LFLF-3LED. To help you further, can you please tell me how you are feeling?
Consumer: nothing madam i just  asking
Bot: You are welcome. Please feel free to ask if you have any other questions.
Consumer: because when i open my daman insurance  is expire thats way i message right now
Bot: Your insurance is active and it is with NAS, not Daman. The marital status shown on your insurance card is a default setting and does not affect your coverage or benefits.
Consumer: thank you so much.have a nice day
Bot: You are welcome. Have a nice day too.
Bot: I hope I was able to assist you today. If you ever need help or feel unwell, please let me know right away. It’s important to speak up so we can guide you and make sure you have all the information and support you need. I’m always here to help! :blush:

:muscle: Stay Safe While You Work
Protect your body when working. Bend your knees (not your back) when lifting heavy things. Use both hands to carry items. Stand up straight to avoid pain or injury."
CHc35d8b3433184d2a9ced23f1c63c877d,GPT_Doctors,BOT,"Consumer: Hi ma'am it's me again
Consumer: Can I ask maam if I go for.check up which clinic or hospital  I can go?
Consumer: I have a running nose
Bot: Hello, I am Doctor Mia.

When did your running nose start?
Consumer: Almost a weeks now maam
Bot: Is your running nose constant, or does it come and go?
Bot: We hope you’re feeling okay! We care about your health and want to help. If you need anything or if it’s urgent, please tell us. We’re here for you.
Bot: I hope I was able to assist you today. If you ever need help or feel unwell, please let me know right away. It’s important to speak up so we can guide you and make sure you have all the information and support you need. I’m always here to help! :blush:

:muscle: Stay Safe While You Work
Protect your body when working. Bend your knees (not your back) when lifting heavy things. Use both hands to carry items. Stand up straight to avoid pain or injury."
CHc511f391bd3f496094edbcf9ba7ba770,GPT_Doctors,BOT,"Consumer: Hello
Bot: I hope I was able to assist you today. If you have any further concerns or your maid ever feels unwell, don’t hesitate to reach out. I'm always here to help! :blush:
Consumer: Hi
Bot: Hello, I am Doctor Mia.
Consumer: Hi can I call you ?
Consumer: Having issues with Margarita for a year now
Consumer: Without a solution
Bot: I understand you would like to speak on the phone. To help you as quickly and accurately as possible, please share the details of the issues you are having with your maid Margarita here in the chat. I can assist with medical or health-related concerns for your maid.
Consumer: She has gastrointestinal problems, had them for more fan a year,
Consumer: Multiple visitors to general doctor and Gastro in the network
Consumer: No improvements
Bot: I understand your maid Margarita has been experiencing gastrointestinal problems for over a year without improvement, even after seeing specialists. For the most accurate assessment and to ensure we understand her symptoms directly, please have your maid contact us at https://wa.me/971506715943 to discuss her health concerns.
Bot: I hope I was able to assist you today. If you have any further concerns or your maid ever feels unwell, don’t hesitate to reach out. I'm always here to help! :relaxed:️"
