Conversation Id,Last Skill,Agent Name,Messages
CH3a39299338264fe1a6e95ce271097504,GPT_Doctors,BOT,"System: Hello from maids.cc,

You were just trying to reach us on a number that is unavailable.

This is our dedicated support line—save it for future use. If you ever need anything, just WhatsApp us here, and we’ll be happy to help.
Consumer: Hi
Consumer: I would like to ask about my nanny insurance
Consumer: Hello
Bot: Hello, I am Doctor Mia. Please have your maid reach out to us directly to discuss her symptoms. This allows for the most accurate and direct symptom assessment.
Consumer: Can i ask about her insurance?
Consumer: Can you send me details of her insurance please
Bot: The insurance will cover 80% of clinic visits, and 70% of the cost if your maid gets medicine from the clinic with a prescription. The insurance is under NAS managed by Orient. The patient’s insurance card number is the following: EKJM-N33F-LFLK-FLED.
Consumer: She is checking with NAS and they are saying inactive
Bot: The Doctor's Manager will reach out to you soon regarding this matter."
CH3a39299338264fe1a6e95ce271097504,Doctor,Miriam Laflouf,"Agent: Does she have her EID please?
Consumer: nan
Agent: Her insurance should be active and linked to her EID directly.
Agent: I hope I was able to assist you today. If you have any further concerns or your maid ever feels unwell, don’t hesitate to reach out. I'm always here to help!:blush:"
CH3b5c4e3fb2e2432988eefd014dc20a8e,GPT_Doctors,BOT,"Consumer: What about her insurance? Can you please send us a copy?
Bot: The insurance certificate is not a physical card. The insurance for your maid is linked to her Emirates ID. Her insurance card number is F2FH-HEJF-LFL3-6LED.
Bot: I hope I was able to assist you today. If you have any further concerns or your maid ever feels unwell, don’t hesitate to reach out. I'm always here to help! :relaxed:️"
CH3beac469478d499488d997dd3918ef18,GPT_Doctors,BOT,"Consumer: Good morning
Consumer: Doc Mia can I ask
Consumer: About the symptoms  I hve
Bot: Welcome to Maids.cc, this is Jane :blush:
How may I assist you today Jeza?
Consumer: Thnk you
Consumer: I'm waitng for doc Mia  about my medical condition
Consumer: Doc mai is there,?
Bot: Hello, I am Doctor Mia. When did your symptoms start?
Consumer: We talkng already  yesterday  right,?
Bot: Yes, we spoke yesterday. Have you taken the pregnancy test yet?
Consumer: You told me I use pt  first
Bot: Yes, I asked you to take a pregnancy test. Have you taken it yet?
Consumer: Yeah
Consumer: I send
Bot: Please let me know the result of the pregnancy test.
Consumer: Is negative
Bot: How long does the bleeding last when it occurs? Is it constant or does it come and go?
Consumer: Start march  my period is not normal
Bot: How would you describe the bleeding? Is it a cutting pain, a soft pain, or a beating pain?
Consumer: Soft pain
Bot: What makes the bleeding or soft pain worse?
Consumer: This may start 2 to 4 use 7pads then stop then this  may 26 to 30  hve period again  and now still spotting but hve 1day more blood
Bot: What makes the bleeding or soft pain better or go away?
Consumer: No hve pain only out to my body
Consumer: But only one time
Consumer: Can you explain  about this situation,?
Bot: How heavy is the bleeding? Is it little, medium, or a lot?
Consumer: A lot but one time then stop
Consumer: That's why I thinking  my period is already  done
Consumer: Then why I hve bleeding
Consumer: But now no hve
Bot: Based on these symptoms, a clinic visit is not required at this time.
You can take Ibuprofen 400mg tablets, one tablet every 8 hours after food, for 3 days if you experience any pain.
Please also consider the following lifestyle advice:
*   Maintain a healthy diet with plenty of fruits and vegetables.
*   Get enough rest and manage stress.
*   Avoid heavy exercise during bleeding.
*   Keep track of your bleeding patterns to share with a doctor if needed in the future.
If your symptoms do not improve or worsen after following this guidance, please reach out again.
Consumer: Ok thnk you doc
Bot: You're welcome. :blush:"
CH3beac469478d499488d997dd3918ef18,Doctor,Miriam Laflouf,"Agent: If the bleeding is still until now, Please visit this clinic and have a check-up :

Al Shifa Al Khaleeji Medical Centre LLC Branch - Dubai	Bayan Business Centre, DIP 1, Dubai, UAE	https://www.google.com/maps/place/55.1727006,24.998111	97148800920
The insurance is by NAS managed by Orient 
This is your Insurance Card Number
EMJN-N33F-LFL6-3LED
Agent: Kindly visit the clinic as soon as possible.
Agent:  I hope I was able to assist you today. If you ever need help or feel unwell, please let me know right away. It’s important to speak up so we can guide you and make sure you have all the information and support you need. I’m always here to help! :blush:

Stay Safe in the Kitchen!
Your hands are your greatest tools—protect them! When using a knife, stay focused and avoid distractions to prevent accidents. Your safety is always my top priority."
CH3c2c865c66af420a9250e94cbcecc2f2,GPT_Doctors,BOT,"Consumer: Hi
Bot: Hello, I am Doctor Mia. Do you have any health concerns I can help you with today?
Bot: We hope you’re feeling okay! We care about your health and want to help. If you need anything or if it’s urgent, please tell us. We’re here for you.
Bot: I hope I was able to assist you today. If you ever need help or feel unwell, please let me know right away. It’s important to speak up so we can guide you and make sure you have all the information and support you need. I’m always here to help! :blush:

:muscle: Stay Safe While You Work
Protect your body when working. Bend your knees (not your back) when lifting heavy things. Use both hands to carry items. Stand up straight to avoid pain or injury."
CH3d05b4f3d40f433c90353056eb80b5cc,GPT_Doctors,BOT,"Consumer: Good morning
Bot: Hello, I am Doctor Mia.
Bot: Good morning. How can I help you with your health today?
Consumer: I have something swollen on my throat and my throat is dry and headache
Bot: When did you start feeling these symptoms?
Consumer: Yesterday morning
Bot: Can you describe the headache? Is it a cutting pain, a soft pain, or a beating pain?
Consumer: A soft pain
Bot: Please look at the picture. Which number shows where your pain is?
Bot: nan
Consumer: 3 the side my throat is swollen
Bot: How long has your throat been swollen and dry?
Consumer: From yesterday morning
Bot: Can you describe the swollen and dry throat?
Consumer: It's samething hard when I touch it
Bot: What makes your throat swelling, dry throat, and headache feel worse?
Consumer: I don't understand
Bot: What makes your throat swelling, dry throat, and headache feel more uncomfortable?
Consumer: It's pain all the time
Bot: What makes your throat swelling, dry throat, and headache feel worse?
Consumer: It's paining all the time
Bot: What makes your throat swelling, dry throat, and headache feel better or go away?
Consumer: I took panadol
Bot: How severe is your throat swelling, dry throat, and headache on a scale of 1 to 10, where 1 is a little and 10 is a lot?
Consumer: 5
Bot: Based on these symptoms, a clinic visit is not required at this time. I recommend you take Panadol Cold & Flu. You can take one tablet every 6 hours for 3 to 5 days.

Here is some advice to help you feel better:
* Drink plenty of warm liquids like water or tea.
* Get enough rest.
* Avoid things that might irritate your throat, like smoke.

You should start to feel better in about 3 to 5 days.
Consumer: Panadol will  remove the swollen
Bot: Panadol Cold & Flu helps with pain and fever, but it may not directly remove the swelling. The lifestyle advice, such as drinking warm liquids and getting enough rest, can help with your overall recovery. Do you have any other questions?
Bot: I hope I was able to assist you today. If you ever need help or feel unwell, please let me know right away. It’s important to speak up so we can guide you and make sure you have all the information and support you need. I’m always here to help! :blush:

:muscle: Stay Safe While You Work
Protect your body when working. Bend your knees (not your back) when lifting heavy things. Use both hands to carry items. Stand up straight to avoid pain or injury."
CH3e0e7ebf66444ce289b2e7ffc1b826b2,GPT_Doctors,BOT,"Consumer: Hi hello GoodAfternoon po
Consumer: Can i ask what the network list of your insurance?
Consumer: Bcoz my nanny plan to go in mediclinic al noor?
Bot: Yes, Mediclinic Hospitals - Madinat Zayed Speciality - WR is covered by the insurance.
Consumer: We are planning to go in al noor mediclinic?
Bot: Please have your maid reach out to us directly to discuss her symptoms. This allows for the most accurate and direct symptom assessment, as we need to speak directly with the patient.
Consumer: Only she need the prescription for her maintenance medicine in high pretension
Consumer: Need to buy her medicine
Bot: Does your maid have a chronic condition like high blood pressure?
Consumer: Yes she have maintenance medicine
Consumer: Everyday she need take medicine in once a day
Bot: Here are the nearest covered Clinics to you:
(1) Mediclinic Hospitals - Madinat Zayed Speciality - WR
Address: https://www.google.com/maps?q=24.490742,54.363785
Telephone: 97128848883


(2) BLOOM PLUS MEDICAL CENTER ABU DHABI PRVSLY AL FALAH MEDICAL CENTRE - ABU DHABI
Address: https://www.google.com/maps?q=24.486099,54.361647
Telephone: 97128865880


(3) Adam & Eve Specialized Medical Center
Address: https://www.google.com/maps?q=24.4931924702432,54.3724366468998
Telephone: 97126767366
Bot: It sounds like your maid has a chronic condition that requires ongoing medication. Please ensure she visits a clinic to get a prescription for her maintenance medicine.
Bot: Your maid should visit a clinic to get a prescription for her daily maintenance medicine.
Consumer: Yes po thank you we do later
Bot: You are welcome. :blush:"
CH3e0e7ebf66444ce289b2e7ffc1b826b2,Doctor,Miriam Laflouf,"Agent: Kindly , Mediclinic Hospitals  are not covered by the insurance, please visit one of the clinics we already provided you with, Thank you
Agent: I hope I was able to assist you today. If you have any further concerns or your maid ever feels unwell, don’t hesitate to reach out. I'm always here to help!:blush:"
CH3e353ea2391e445da1cfd791216cb8e8,GPT_Doctors,BOT,"Consumer: good afternoon
Consumer: may i ask something about our insurance
Bot: Welcome to Maids.cc, this is Jane :blush:
How may I assist you today Juna?
Consumer: i want to go doctor nxt week for my lower back pain. is our insurance be seen in our emirates id?
Bot: Thank you for reaching us today! Kindly do not hesitate to chat with us again for future concerns. Have a good night!
Consumer: did you answer my concern????
Bot: Your insurance is linked to your Emirates ID. Your insurance card number is JJF3-J23F-LFL2-JLED.

I can help you with your lower back pain. Please look at the picture. Which number shows where your pain is?
Consumer: which picture?
Bot: Please look at the picture. Which number shows where your pain is?
Bot: nan
Consumer: unnder 7,8,9
Bot: How long have you had this pain?
Consumer: 2 weeks
Bot: Can you describe the pain? Is it a cutting pain, a soft pain, or a beating pain?
Consumer: cutting pain
Consumer: going to my legs
Bot: What makes the pain worse?
Consumer: when im sitting
Bot: What makes the pain better or go away?
Consumer: if im standing and working i cannot feel pain that much. only when i sit
Bot: Based on these symptoms, a clinic visit is not required at this time.

I recommend you take Ibuprofen 400mg tablets.
Take one tablet every 8 hours for 5 days.

Here is some advice that may help you:
* Try to avoid sitting for long periods.
* When you sit, make sure your back is straight and supported.
* You can use a small pillow behind your lower back for support.
* Try to walk around for a few minutes every hour if you are sitting for a long time.
* You can also apply a warm compress to your lower back for 15-20 minutes a few times a day.

You should feel better in about 3 to 5 days. If your pain does not improve or gets worse, please let me know.
Consumer: ok thank you
Bot: You're welcome! :blush:"
CH3e353ea2391e445da1cfd791216cb8e8,GPT_Doctors,Leen Rizk,"Agent: Do you have any numbness or tingling sensations? 
Consumer: in lower hip
Consumer: left side
Agent: Do you have a fever?  
Consumer: no
Agent: When did it start exactly? 
Consumer: may 28
Agent: Allow me a moment, please. 
Agent: Do you have a leg weakness? 
Consumer: only pain when lower back is pain.
Agent: And you mentioned that the pain radiates to one leg with a numbness sensation , is that correct?
Consumer: yes
Agent: You can visit
Clinic name: Al Wahda Medical Center
Location : https://maps.app.goo.gl/XPHoU9F7mtuzZSYz7
Number: +97126418383
Agent: Your helper’s Insurance Card Number is  JJF3-J23F-LFL2-JLED . Her insurance is provided by NAS and managed by Orient. Please ensure that she always carries her Emirates ID.

Her policy covers 80% of clinic visits and 70% of pharmaceutical costs.
Consumer: thank you
Agent: You are always welcome!
Agent: I hope I was able to assist you today. If you ever need help or feel unwell, please let me know right away. It’s important to speak up so we can guide you and make sure you have all the information and support you need. I’m always here to help! :blush:

Stay Safe in the Kitchen!
Your hands are your greatest tools—protect them! When using a knife, stay focused and avoid distractions to prevent accidents. Your safety is always my top priority."
CH40e97eb9f3834e7daf0709f6c655feac,GPT_Doctors,BOT,"Consumer: Good morning
I just want to ask if still we can have our medical check up in aster clinic
Bot: Good morning! To help you best, can you please tell me what symptoms you are experiencing or what kind of medical check-up you need? Understanding your symptoms will help me determine the best course of action.
Consumer: Always have this headache ,I admitted I'm lack of sleep always,I can't reach 8 hours a day
Consumer: That sometimes leads me to dizziness
Bot: Please look at the picture. Which number shows where your pain is?
Bot: nan
Consumer: 1  6
Bot: How long have you been having these headaches?
Consumer: Just few months
It will trigger if I don't eat
Bot: Based on these symptoms, a clinic visit is not required at this time. You can take Panadol Extra tablets for your headache.

*   Take 1 tablet of Panadol Extra every 6 hours as needed.
*   Try to get 7 to 8 hours of sleep every night.
*   Eat your meals regularly and do not skip them.
*   Drink plenty of water throughout the day.
*   Try to reduce stress.

You should feel better in a few days. If your symptoms do not improve or get worse, please reach out again.
Consumer: I want lso to check my blood pressure,maybe this is one of thee reason..
Bot: Do you have a chronic condition like high blood pressure?
Consumer: I think o..high blood
Bot: Here are the nearest covered Clinics to you:
(1) Al Shifa Al Khaleeji Medical Centre LLC Branch - Dubai
Address: https://www.google.com/maps?q=24.998111,55.1727006
Telephone: 97148800920


(2) G S M MEDICAL CENTRE (AL SATWA) DUBAI
Address: https://www.google.com/maps?q=25.0041191,55.1522054
Telephone: 97148831002


(3) Houston Medical Clinic (Al Barsha) - Dubai
Address: https://www.google.com/maps?q=25.116645,55.205853
Telephone: 97143850603
Bot: Do you have any other symptoms you would like to discuss, or would you like to proceed with a visit to one of the clinics for your blood pressure check?
Consumer: This is now our clinic that covered with our insurance"
CH40e97eb9f3834e7daf0709f6c655feac,GPT_Doctors,Leen Rizk,"Agent: You can check your blood pressure at any nearby pharmacy. If it’s high, it’s better to visit the GP at the clinic. If it’s normal, you can try the medications I recommended earlier.
Consumer: Okay I'll just visit for check up
Agent: I recommend visiting a pharmacy to measure your blood pressure, as routine check-ups are not covered by the insurance.
Agent: Do you have a fever, vomiting, or nausea? 
Consumer: Okay
I will just go on my dy off thank you
Consumer: Just dizziness
Agent: Measure your blood pressure and let me know. 
Consumer: Okay,later when I'm done with my work
Agent: No problem, I am always here to help. Keep me updated. 
Consumer: Okay madam,thank you
Agent: Always welcome! 
Agent: Medically speaking, you are eligible for 1 day of sick leave; please inform your client about it politely"".
Agent: Sorry rosalie. please disregard the previous message, it was sent by mistake. 
Consumer: It's okay madam,thank you
Agent: Thank you, Rosalie! 
Hope you will feel better soon. 
Consumer: Thank you madam..
Agent: Always welcome!
Consumer: Soon I will go to that clinic..
Agent:  I hope I was able to assist you today. If you ever need help or feel unwell, please let me know right away. It’s important to speak up so we can guide you and make sure you have all the information and support you need. I’m always here to help! :blush:

Stay Safe in the Kitchen!
Your hands are your greatest tools—protect them! When using a knife, stay focused and avoid distractions to prevent accidents. Your safety is always my top priority."
CH413a8a5a26ee408396ac17f9f84f08a5,GPT_Doctors,BOT,"Consumer: hello good evening!
Consumer: may I ask which are the pharmacy is covered in satwa for the insurance?
Bot: Could you please let me know what you are experiencing? The condition might not require a clinic visit, and I might be able to assist you here.
Consumer: I already visited the clinic today because of my heel pain for long time
Bot: Here are the nearest covered Pharmacies to you:
(1) Real 6 Pharmacy - Dubai 
Address: https://www.google.com/maps?q=25.211205,55.2723503
Telephone: 97143529988


(2) Zayd Pharmacy - Dubai 
Address: https://www.google.com/maps?q=25.215272,55.276701
Telephone: 97143291325


(3) Aster Pharmacy 201 - Dubai
Address: https://www.google.com/maps?q=25.218215,55.278892
Telephone: 97143209481
Bot: Do you have a prescription from the clinic for your medication?
Consumer: yes ma'am I already have
Consumer: thank you so much
Bot: You are welcome.
Bot: I hope I was able to assist you today. If you ever need help or feel unwell, please let me know right away. It’s important to speak up so we can guide you and make sure you have all the information and support you need. I’m always here to help! :blush:

:muscle: Stay Safe While You Work
Protect your body when working. Bend your knees (not your back) when lifting heavy things. Use both hands to carry items. Stand up straight to avoid pain or injury."
CH426fc494429049af8102dd84b345dd1f,GPT_Doctors,BOT,"Consumer: Good morning
Consumer: Do we have clinic in satwa coveted by the insurance
Bot: Hello, I am Doctor Mia.

To help you find the right clinic, please tell me about the patient's symptoms.
Consumer: My runny nose head ache ,this is long time doctor here is also give me a receipt but it's not heal
Bot: nan
Consumer: It's been long time I need to go doctor for check up and give a good medication for me
Consumer: 1
Bot: Please look at the picture. Which number shows where your pain is? Do you have any known chronic conditions or allergies?
Consumer: Number 1
Bot: I understand you have been experiencing this headache for a long time and the previous medication did not help. Before I provide clinic information, do you have any known chronic conditions or allergies?
Consumer: I don't know what is the chronic that's I need to go doctor to know this
Bot: A doctor can help you understand your health and determine if you have any chronic conditions. I can help you find a clinic if you would like.
Consumer: What is chronic,how do I know this if I not go doctor
Bot: A chronic condition is a health problem that lasts for a long time, often for many months or years. You would usually know if you have one because a doctor would tell you after they have examined you and done some tests.

Since you want to know more about your health, I can help you find a clinic. Would you like me to find the nearest clinics in Satwa for you?
Consumer: I consult here because I want a referral to use my insurance
Bot: According to your insurance policy, you must first see a General Practitioner. If a specialist is needed, the General Practitioner will provide a referral for you.
Consumer: Where I go
Bot: You can go to any clinic that is covered by your insurance to see a General Practitioner. They will be able to assess your health and provide a referral if you need to see a specialist.
Consumer: So any clinic is covered by the insurance
Bot: The insurance will cover 80% of clinic visits, and 70% of the cost if you get medicine from the clinic with a prescription. The insurance is under NAS managed by Orient.

To help you further, please tell me about your symptoms so I can guide you to the best course of action.
Consumer: My runny  nose ,block nose headpains
Bot: When did your runny nose, blocked nose, and headaches start?
Bot: How would you describe the headache? Is it a cutting pain, a soft pain, or a beating pain?
Consumer: It's been long time I go doctor before but again and again
Bot: How would you describe the headache you are feeling? Is it a cutting pain, a soft pain, or a beating pain?
Consumer: Beating pain
Bot: What makes your runny nose, blocked nose, or beating headache worse?
Consumer: Blocking nose, or same
Bot: What makes your runny nose, blocked nose, or beating headache feel worse?
Consumer: Because of my  blocked nose my head is pain dam like heavy
Bot: What makes your runny nose, blocked nose, or beating headache feel better?
Consumer: Blocked nose
Consumer: I want to go doctor please
Consumer: This really hard for work
Bot: Allow me a moment, please. :blush:
Bot: I understand you want to go to a doctor because of your blocked nose and headache. To help you best, I need to understand more about your symptoms. This will help us determine the best course of action, which might include something you can manage with over-the-counter medicines and lifestyle advice.

Can you tell me when your blocked nose and headache started?
Consumer: Its almost a month I go doctor before at aster but not heal
Bot: Understanding your symptoms fully helps me give you the best advice. Sometimes, conditions can be managed with simple over-the-counter medicines and lifestyle changes, which can save you a trip to the clinic.

What makes your runny nose, blocked nose, or beating headache feel better?
Consumer: Why the question is again and again
Consumer: I want to go doctor I need a referral to use my insurance
Bot: I understand you want to go to a doctor and use your insurance. Knowing your symptoms helps me make sure you get the right care, whether it is something you can treat at home or if a clinic visit is truly needed.
Consumer: I have blocked nose,or beating head ache
Consumer: I do I know my symptoms if not go doctor
Bot: Here are the nearest clinics for you:

*   **Mediclinic Arabian Ranches**
*   **Aster Clinic, Arabian Ranches**
*   **Prime Medical Center, Motor City**

Your insurance card number is 3JM6-N33F-LFLK-MLED.
Consumer: Thanks you
Bot: You are welcome! :blush:
Consumer: And sorry for the inconvenience I was really irritated because of this
Bot: I understand. I am here to help you. Please let me know if you need anything else.
Bot: I hope I was able to assist you today. If you ever need help or feel unwell, please let me know right away. It’s important to speak up so we can guide you and make sure you have all the information and support you need. I’m always here to help! :blush:

:muscle: Stay Safe While You Work
Protect your body when working. Bend your knees (not your back) when lifting heavy things. Use both hands to carry items. Stand up straight to avoid pain or injury."
CH42b89a19df2747708a22b24db7aa8764,GPT_Doctors,BOT,"Consumer: Hello good day
Consumer: Where I can a doctor?
Bot: Hello, I am Doctor Mia. To help you find the right doctor, please tell me about your symptoms.
Consumer: Hello doc,. This morning when i wake up, I feel pain in my left chest when I breath, until now the sharp pain is still.
Bot: Can you describe the pain? Is it a cutting pain, a soft pain, or a beating pain?
Consumer: Cutting pain maybe, I cannot describe well.. The more deeply I breathe the pain I feel.. Something like that..
Bot: I understand you are experiencing cutting pain in your left chest when you breathe deeply. This requires urgent medical attention. I will help you find the nearest clinics.
Consumer: Is it a high risk factor for a heart problem doc? Or whatever?
Bot: I cannot tell you if it is a high risk factor for a heart problem. It is important to see a doctor to understand your condition. I will help you find the nearest clinics.
Consumer: Okay doc I understand..
Bot: Please share your full address, including the street, apartment, and city, so I can find the nearest clinics for you.
Consumer: The Gardens, Building 128,F14 Camilia Street Dubai"
